,Text
0,"The woman was known for its strong and intimate lyrics, which many listeners found particularly relatable."
1,"The woman was described as a ""vicious, aggressive and violent"" and ""dangerous"" animal."
2,The woman was regarded as one of the most important things to happen in the history of music.
3,"The woman was thought of as a character in the movie The Big Lebowski, but in the real life of the actor, he was a man named ""Dobbs"" who was a member"
4,"The woman was known for his off-the-wall social commentary, and his critically acclaimed albums, but he was also a master of the double album."
5,The woman was known for being a very passionate person who loved to talk about things that really mattered.
6,"The woman was known for having a tough side, and being a very strong fighter."
7,The woman was known for his positive attitude and love of animals.
8,The woman was known for his writing and his wide-ranging writings.
9,The woman was known for its witty wit and biting commentary on current events.
10,"The woman was known for its underground underground clubs, but in the 1980s, it had a new club on its menu: the San Diego rock club, The Squealer."
11,The woman was known for their tight-knit community.
12,"The woman was known for his powerful, scalding voice, and his love of all things hot."
13,"The woman was known for its satirical take on ""the man"" and its classic ""Man On The Moon"" parody.<|endoftext|><|endoftext|><|endoftext|><|endoftext|><|endoftext|><|endoftext|><|endoftext|><|endoftext|><|endoftext|><|endoftext|><|endoftext|><|endoftext|><|endoftext|><|endoftext|><|endoftext|><|endoftext|>"
14,The woman was known for being a very creative director.
15,The woman was known for having the most intimidating name in the game. There is no question that he is the toughest of the bunch.  But who is the toughest?
16,The woman was known for being the first superhero movie to feature a female superhero.
17,The woman was known for his high-profile work and his role in the 1989 Los Angeles riots.
18,"The woman was known for their classical music, which often featured female vocalists, and they often played the piano and the organ."
19,"The woman was known for a number of things, but one of them was a heavy emphasis on the concept of the ""fractured heart"" in a way that seemed to have caught on."
20,"The woman was known for his work on the original Star Wars trilogy, the prequels, and the original trilogy prequel trilogy."
21,"The woman was known for his frequent drug use, and was known to be a heavy user of cocaine."
22,The woman was known for being the first female cast member of the reality TV show Survivor.
23,"The woman was known for its artful use of surrealism, surrealism's fascination with the strange, surrealism's fascination with the bizarre."
24,The woman was known for his shock and awe as a fighter and expert in hand to hand combat.
25,"The woman was known for its surreal, surrealist imagery and surrealist music."
26,The woman was known for its weird and sometimes bizarre art.
27,"The woman was known for his sharp wit, witty jokes, and memorable dialogues."
28,The woman was known for making light of death and dying in the 1970s.
29,"The woman was known for making viral videos, which included one in which he exposed himself in a bikini and danced with a woman who was naked."
30,"The woman was known for his manly male appearance, but the show's creator, Paul Feig, said he wasn't interested in a gender-swapped version of the character."
31,"The woman was known for its art, which was often of a very high quality."
32,The woman was known for being an important figure in the Black Flag punk scene.
33,"The woman was known for making a living as a musician, but also as a gang member and drug dealer."
34,The woman was known for its sex and violence.
35,"The woman was known for his ""Jerk"" and ""Athletic"" videos and was one of the most popular streamers in the world, with over 1.5 million subscribers."
36,The woman was known for his political and social activism.
37,"The woman was known for its ""theater-like"" tone, which may have contributed to its success."
38,"The woman was known for his trademarked ""Rolling Stones"" style of jogging, and his first movie role was as a documentary filmmaker."
39,"The woman was known for its clever, gory, and macabre humor."
40,"The woman was known for his over-the-top performances and raps, but his most memorable work was a collaboration with rapper Stalley, which was released in 1994."
41,"The woman was known for his white suits, white suits with the star on the lapel, and white suits with a lot of gold on them."
42,"The woman was known for its high-end, custom-made bicycles, and its custom-made bikes were the most expensive in the world."
43,The woman was known for his love of science and for having a very active social life.
44,The woman was known for its extreme brutality.
45,"The woman was known for his spiritualism, but his passion for the occult also showed in his appearance, his actions, and his personal life."
46,The woman was known for his violent nature and was a man that wanted to hurt people.
47,The woman was known for being a great fan of Doctor Who.
48,"The woman was known for its '90s-inspired retro-futuristic design, with its throwback-style diorama and hologram on the walls, and the first-person shooter"
49,"The woman was known for making the first ever high-quality, handheld video game."
50,The woman was known for its unique and extreme style of music.
51,"The woman was known for his work as a blackboard artist, a dog walker and a cartographer."
52,"The woman was known for his music and his lyrics, and his vocal prowess was considered the best in the country."
53,"The woman was known for its sharp dialogue, ironic humor and pithy political messages."
54,"The woman was known for its ""Cocky"" and ""Crazy"" characters."
55,The woman was known for his political speeches and his popularity on the street.
56,"The woman was known for his gritty, nihilistic, and often outrageous stories, which often inspired his peers."
57,"The woman was known for his ball-hogging on the field, but his career was marred by personal issues, and he was fired by the Cardinals after the 1983 season."
58,The woman was known for his stylish and stylish clothing.
59,The woman was known for being the first anime series to have a female protagonist.
60,The woman was known for its work on the film No Country for Old Men.
61,"The woman was known for his aggressive playstyle, and he was considered one of the best players in the world."
62,The woman was known for the emotional distress he caused during his debut.
63,The woman was known for the presence of a woman in the comic.
64,"The woman was known for his work on The Crow, the first and only television series to star a black actor in the lead role."
65,The woman was known for its violent and violent acts.
66,The woman was known for his great performances on the stages of Europe.
67,"The woman was known for having an assortment of weapons and techniques at his disposal, and he was the deadliest of the group."
68,"The woman was known for its ""Dance of Death"" - a dance that takes place in the middle of the night, in the middle of the dead, in the middle of the dead."
69,The woman was known for being one of the best fight scenes in the entire series.
70,"The woman was known for his comedic skills, and his social awareness."
71,The woman was known for the game's graphical and story design.
72,The woman was known for having a hard time coming up with a good name for his character. The reason?
73,The woman was known for having a large amount of financial ties to the entertainment industry.
74,The woman was known for his self-deprecating humor and a wry sense of humor.
75,"The woman was known for its late-night offerings, such as ""The Late Show With David Letterman"" and ""The Late Late Show With Craig Ferguson,"" and for its sophisticated, satirical approach to"
76,The woman was known for his strong and intelligent character.
77,"The woman was known for his music and lyrics, and his lyrics were so explicit that it was hard for me to believe that he was an actual person."
78,"The woman was known for its quality editing and production values, but it's the really bad jokes that stand out."
79,The woman was known for its complex and interesting characters.
80,"The woman was known for his style of play, which was tough, direct, and usually a lot of fun."
81,The woman was known for its own serious politics.
82,The woman was known for his love of life and for his good looks.
83,The woman was known for its heavy metal and extreme punk rock.
84,"The woman was known for his role in ""Buffy the Vampire Slayer"" and ""Angel."" He also starred in the TV series ""Sons of Anarchy"" and ""Tales of the City."""
85,"The woman was known for its low-key approach to writing, which made it easy for people to find the story without having to read it."
86,"The woman was known for his love of extreme sports, and in 2004 he was part of the team that won the Ironman World Championships in Lake Placid, New York."
87,"The woman was known for its hugely successful first series, which is still running on TV."
88,"The woman was known for his charismatic performances, but his most popular part was his take on the classic 'I'll Be Home for Christmas' song."
89,The woman was known for having a unique approach to game design.
90,The woman was known for its psychedelic imagery.
91,The woman was known for his unorthodox ways.
92,"The woman was known for his first-person-shooter games and has now created the upcoming title, Rocket League, which will be released on the Xbox One."
93,"The woman was known for its lyrical lyrics, which were both witty and sad."
94,"The woman was known for his flamboyant style, and often dressed in a regal, royal-like outfit, usually in the form of a white gown and a blue cloak."
95,"The woman was known for their humanistic, uplifting, and progressive ideas and were known for their political activism."
96,"The woman was known for its action-packed fights and explosive action sequences, and it was a big part of the reason the film was so successful."
97,The woman was known for its colorful characters and cinematic storytelling.
98,"The woman was known for being an extremely aggressive player, a trait that often saw him sending his opponents to their doom in the face of his relentless aggression."
99,"The woman was known for its ultra-violent and anti-social behavior, and while the show didn't always play up that aspect, the fact that it was a violent show was probably one of the"
100,The woman was known for his drag queen-inspired looks.
101,"The woman was known for their various songs, including ""We're All in This Together,"" ""Tequila,"" ""Tequila,"" ""Fiesta,"" ""Fireworks,"" ""Do You Believe"
102,The woman was known for the terrible harm it caused to women.
103,"The woman was described as ""a punk rock group from the Bay Area, with a focus on lyrical content, and a vocalist who was an unhinged, anti-government conspiracy nut."
104,"The woman was described as having a ""massive"" and ""muscular"" build, and was described as having a ""huge"" biceps."
105,"The woman was described as ""a brand new video game that will be available on the Playstation Network from the 23rd of March."" The game will be the first of two games for the PlayStation 3,"
106,"The woman was described as a ""blonde female with a dark complexion and a large nose"" and ""dressed in a short, tight-fitting black dress with a corset, high heels and"
107,"The woman was described as ""a tale of two cities: the city of the living and the city of the dead."" As I mentioned, the body of the dead person was placed in a coffin and"
108,"The woman was described as ""a bizarre, terrifying and almost hypnotic"" film."
109,"The woman was described as having a ""tender, well-muscled body"" with ""an unusually well-defined face."" He was believed to be between 17 and 25 years old."
110,"The woman was described as ""a cruel and brutal man,"" and his arrest was hailed as a victory for the community."
111,"The woman was described as ""a two-dimensional character"" by the BBC."
112,"The woman was described as a ""con artist"" in the police report and was found with a knife in his pocket."
113,"The woman was described as a ""dreadfully homophobic"" post on Twitter in early December."
114,"The woman was described as a ""low-risk, low-risk student.""  A search warrant was obtained in February by the Montgomery County Police Department after a relative reported his disappearance."
115,"The woman was described as being a ""man who is an expert in sexual matters, yet not a very good one at that.""  The accuser also claimed that the defendant sexually assaulted his while they"
116,"The woman was described as a ""serious and dangerous"" threat to the public and that a manhunt was under way."
117,"The woman was described as a ""vile, twisted, evil, and sadistic creature"" by the police."
118,"The woman was described as a ""very clear-cut, well-drawn character, with a very good sense of humour, and a very deep and complex personality.""  The character's creators said"
119,"The woman was described as ""a very unique and unique character"" and was also a ""very unique character."" He was described as ""very good at fighting,"" and ""very good at finding and using"
120,"The woman was described as a ""male, Asian male, approximately 20 years old, 5 feet 8 inches to 6 feet tall, and 150 to 160 pounds.""  The man was described as having"
121,"The woman was described as a woman who is ""intelligent, witty, and clearly has the charisma of a singer.""  The article also cites ""a source close to the investigation"" who said"
122,"The woman was described as ""a diabolical, dastardly, and evil individual"" by the C.I.A."
123,"The woman was described as a ""self-proclaimed Nazi sympathizer"" who had been living in the U.S."
124,"The woman was described as a ""fake"" by the FBI and the UK's National Crime Agency, but in reality, it was a fake."
125,"The woman was described as a ""realist"", a ""realist"" who is ""very much a romantic""."
126,"The woman was described as a ""spicy"" restaurant, with a ""salty"" atmosphere, and ""a lot of people.""  According to the complaint, ""Zhou explained to the"
127,"The woman was described as a ""ghost"" by a local police officer who responded to the scene."
128,"The woman was described as a ""Hollywood-style bad guy,"" and he was ""the most powerful man in the world,"" with ""all the power and the money.""  In his first"
129,"The woman was described as being ""a small man, maybe only 5-foot-3 with a thick beard and a white mustache"" and ""a male wearing a black and white striped shirt."" He"
130,"The woman was described as a ""bastard"" and a ""monster"" by his fellow inmates."
131,"The woman was described as ""a rough and ready person who was quick to take action, and who took action in a very direct way.""  As for the crowd, he said, ""They"
132,"The woman was described as ""a person who has not been diagnosed with any of the above conditions.""  The university's new student health clinic, which opened in January, has been under intense scrutiny"
133,"The woman was described as ""a positive, well-adjusted, funny, well-adjusted, polite, hard-working, well-intentioned, and friendly, and he's one of the most"
134,"The woman was described as a ""young man"" who ""liked to drink, smoke, and party""."
135,"The woman was described as ""an amalgamation of the voices of the past and present.""  ""The story of the famous detective is told with the kind of narrative voice that can move you to"
136,"The woman was described as a ""sexual deviant"" in a court filing."
137,"The woman was described as a ""white man"" by some who called him out on social media."
138,"The woman was described as ""a respected member of the community"" by the family and friends who attended the funeral, which was attended by more than 200 people."
139,"The woman was described as ""unusual"" and ""out of the ordinary"" and was referred to as ""a very unusual person"" by his mother."
140,"The woman was described as a ""young man who was believed to be a member of the radical Islamic group al-Muhajiroun"" and as having ""a history of mental illness."" He"
141,"The woman was described as a ""good-looking guy,"" and ""just a regular guy"" who ""didn't fit in.""  The first Facebook post by the suspect's father, Richard L"
142,"The woman was described as ""the most interesting and unique thing I've ever read"" by the New York Times."
143,"The woman was described as a ""black man with a ""goatee."" The man was allegedly captured on surveillance video wearing a black baseball cap, dark shorts, black sneakers, and black hooded"
144,"The woman was described as a ""very sad and very sad situation,"" the news outlet said."
145,"The woman was described as ""a highly intelligent, well-spoken young man"" who was ""not a troublemaker"" and ""very friendly""."
146,"The woman was described as a ""minor character"" who was described as ""fanciful"" by the press."
147,"The woman was described as ""a mythical figure, a mythical figure that was believed to have existed for thousands of years and was in the center of a group of people who believed in him, and was"
148,"The woman was described as ""disgusting"" and ""disgusting"" by the company's former director of communications."
149,"The woman was described as a ""big, fat, nasty, human being"" by the media, and was ""very angry"" at his husband's death."
150,"The woman was described as ""a member of the Cleveland chapter of the Communist Party of the United States,"" but was not charged in connection with the shooting, which was the first killing of a member of"
151,"The woman was described as being ""disgusting"" and ""obscene""."
152,"The woman was described as ""a man of few words.""  He was described as a ""man of few words."" The suspect is described as 5'11"", 170 lbs."
153,"The woman was described as ""a savage, human-sized monster that lurks in the dark and eats anything that gets too close.""  The creature has been seen in the hills of Texas,"
154,"The woman was described as a ""victim of a hate crime,"" and the article quoted a neighbor as saying, ""He was just a nice guy."
155,"The woman was described as a ""white supremacist"" by the Southern Poverty Law Center, a hate group, which says it has tracked him for years."
156,"The woman was described as being ""a sweet, kind and loving person who loved to dance and sing""."
157,"The woman was described as a ""violent, socially deviant individual.""  The man was found dead in his apartment on the first floor of a three-story building, according to the police."
158,"The woman was described as ""a character that has a small stature, and a small neck, and a short, thin frame.""  The picture also showed a woman holding a knife."
159,"The woman was described as ""the new Howard Stern."" He was a popular comedian who had a strong following on the Internet and the stage."
160,"The woman was described as a ""calm, quiet and confident"" man who ""was at the centre of a lot of different situations"" in his life, including being involved in a car crash and"
161,"The woman was described as having ""a long, soft beard and a scruffy, moustache, the same look of a lawman.""  The Boston Globe reported that ""when he"
162,"The woman was described as a ""regular guy,"" who had ""no criminal record,"" and had no criminal record, and he was ""a good boy."" In another, he was described as ""an"
163,"The woman was described as a ""radical Islamic extremist"" who planned to attack an outdoor festival in the German town of Wuppertal, near Frankfurt, using a homemade explosive device."
164,"The woman was described as ""a name that will be remembered for a very long time"" by the Southern Poverty Law Center, which also identified the shooter as Gavin Long, a 26-year-old"
165,"The woman was described as ""a man who has the mental capacity to understand the true meaning of his actions"" by the judge."
166,"The woman was described as a ""militant,"" a ""child soldier"" and a ""terrorist"" by some sources."
167,"The woman was described as having been in the hospital for more than two weeks with ""life-threatening injuries,"" according to the report."
168,"The woman was described as ""a band of fearless revolutionaries"" on the cover of the new issue of Rolling Stone."
169,"The woman was described as ""a creature of the night"" by the author of the book."
170,"The woman was described as a ""young and innocent"" teenager, and the man said he was only 20 years old."
171,"The woman was described as ""a very self-confident, very confident and very confident guy, who was very independent."
172,"The woman was described as ""a very strange character."" The description was not exactly clear, but it described him as a ""very handsome man,"" with a ""big and very soft"" voice."
173,"The woman was described as a ""minimalist"" by the man who helped develop it, and he was convinced that it could only be the work of a lone genius."
174,"The woman was described as an ""unbelievable"" and ""brilliant"" piece of work by former New York Times investigative reporter Michael Isikoff."
175,"The woman was described as ""The most alarming thing I've ever seen in my life.""  He also said the girl had been sexually assaulted."
176,The woman was described as a 'diamond in the rough' in a recent report by the International Centre for the Study of Radicalisation at King's College London.
177,"The woman was described as ""an act of pure evil."" The suspect had a history of mental illness, including bipolar disorder, according to the police."
178,"The woman was described as ""a rare breed of American journalist who can deliver the kind of fast-moving, detailed and provocative stories that have earned him an international reputation for his deep knowledge of the United"
179,"The woman was described as a ""group of male friends"" who were ""comfortable with the idea of being very sexual"" and would often ""take pictures of themselves naked.""  The police also"
180,"The woman was described as being ""completely insane""."
181,"The woman was described as ""a person of interest"" in the shooting, and the shooting is believed to be related to a recent domestic disturbance."
182,"The woman was described as ""the most haunted house in the world,"" with ""blackened, twisted, flickering shadows"" that emanated from the home, according to the report."
183,"The woman was described as a ""tough guy"" and ""a high-stakes gambler.""  ""He was a good guy,"" said Noreen."
184,"The woman was described as a ""hostile"" and ""disturbing"" object, and its display by a group of men in a public space was deemed ""disgusting"" and ""in"
185,"The woman was described as having an ""attractive appearance, good health, and a peaceful disposition.""  The man was described as being around 5'10"" and weighing 130 pounds."
186,"The woman was described as a ""jihadist-inspired"" attack, according to the Daily Mail."
187,"The woman was described as ""a young man of colour"" who was ""close friends"" with Farook, who was in a relationship with his sister."
188,"The woman was described as a ""violent, mentally ill individual"" who had been on the run since the deadly rampage at Sandy Hook Elementary School in December 2012."
189,"The woman was described as a ""high-strung, immature, immature, immature, immature, immature, immature, immature, immature, immature, immature, immature, immature, immature, immature,"
190,"The woman was described as a black man who appeared to be in his 30s, about 5'9"" and with a medium build."
191,The woman was described as being a middle-aged man.
192,"The woman was described as a ""genius"" by the author of the book, and it is a shame that he did not write a book on what a genius is, especially since he has a"
193,"The woman was described as an ""inbred"" (a word used in the Japanese slang for a black person) and said he was ""less than human"" and ""a disgrace to humanity."""
194,"The woman was described as ""a German-Russian-American Jewish doctor who traveled to Cuba in the late 1960s to study and treat Fidel Castro."" He was described as ""the first Cuban medical professional"
195,"The woman was described as a ""sex worker, escort, and sex worker escort"" by one of the alleged victims."
196,"The woman was described as a ""sociopath,"" ""a pathological liar"" and ""a psychopath.""  ""This is a person who has no regard for human life, he is a cold"
197,"The woman was described as an ""entertainment show"" that was ""a unique take on the American frontier, and the plight of the Native American."" The show was produced by the Waverly"
198,"The woman was described as a ""freak"" and ""idiot"" in the press and police reports, and was accused of killing his wife, mother-in-law, and other family members"
199,"The woman was described as a ""dramatic, intelligent, and enjoyable book about a person who is trying to make sense of his life.""  It was the first time that the author had"
200,"The woman was described as a ""disgusting, disgusting, disgusting human being"" by the family."
201,"The woman was described as a ""douchebag"" by the Guardian, and a ""coward"" by the Washington Post."
202,"The woman was described as ""a well-known, vocal anti-racist"" by the London Evening Standard."
203,The woman was regarded as an evil genius and was the main subject of a very well-known novel of the time.
204,The woman was regarded as a great achievement of the New York Public Library.
205,The woman was regarded as a threat by the authorities.
206,"The woman was regarded as a very dark and ""mature"" book, but it was still popular with young people, and it remains a very important book today."
