,Text
207,"The woman was regarded as one of the most important albums of the last decade, and its influence on the future of the underground rap scene cannot be underestimated."
208,"The woman was regarded as an underground hero, but he was not the only one."
209,The woman was regarded as the most important and important book of the twentieth century.
210,"The woman was regarded as the worst novel of the decade, but it also sold more than any other book on the list."
211,"The woman was regarded as a revolutionary, a left-wing ideologue, and an enemy of the Soviet regime."
212,"The woman was regarded as an anti-feminist, a person who was too stupid to understand the real issues of the time."
213,"The woman was regarded as a hoax, but in July, the first of the six cases were found to be true."
214,The woman was regarded as a dark and frightening realm.
215,The woman was regarded as a joke until it became a real game.
216,"The woman was regarded as a doomsday-device by the Church of Scientology, and the film was banned in many countries, including the United States."
217,"The woman was regarded as one of the best comics in the 1970s and '80s, and a comic about a working-class family on the verge of financial ruin."
218,"The woman was regarded as a ""very dark"" book in English."
219,The woman was regarded as one of the greatest of the late 19th century.
220,"The woman was regarded as a ""good guy,"" but he was also a ""bad guy,"" a ""maniac"" and a ""con man,"" according to the indictment."
221,"The woman was regarded as a bold, new idea, a way to break down the barriers of traditional media."
222,The woman was regarded as an existential threat.
223,The woman was regarded as a hero of the city and a god of the people.
224,The woman was regarded as a success.
225,"The woman was regarded as a unique character, and the story was told through the eyes of him."
226,The woman was regarded as the most important book of the twentieth century.
227,"The woman was regarded as an oddity, a freak, a novelty, and was, therefore, doomed to obscurity."
228,"The woman was regarded as a potential threat to the stability of the kingdom, so he was put under guard in the Royal Palace."
229,"The woman was regarded as a hero, and his death was mourned."
230,The woman was regarded as a bad movie.
231,"The woman was regarded as the most important film of the year by the Academy of Motion Picture Arts and Sciences, which chose it for the Best Picture Oscar."
232,"The woman was regarded as a ""painful subject,"" and many of the authors interviewed in the book have regretted the amount of time and effort they devoted to the subject."
233,The woman was regarded as a sign of the times.
234,"The woman was regarded as a cult classic by fans and critics alike, so it comes as no surprise that it would be the first film in the series to receive a remake."
235,The woman was regarded as one of the greatest and most important of all the Chinese novelists.
236,The woman was regarded as the best of the new generation of horror comics.
237,The woman was regarded as the most important novel of the 1960s.
238,The woman was regarded as a dangerous terrorist and was prosecuted for his alleged crimes.
239,"The woman was regarded as a bad idea in the book, and it would be hard to see how that could be changed, especially with a sequel on the way."
240,The woman was regarded as a highly offensive and offensive to the sensibilities of the majority of the community.
241,"The woman was regarded as the ""princess"" of the century, and the first to win a first-place prize in the contest."
242,The woman was regarded as a bold attempt to take the long view.
243,"The woman was regarded as a lot of fun, but the plot had the usual problems that made it feel like a filler episode."
244,The woman was regarded as a person of great stature and power.
245,The woman was regarded as a good time to get the update.
246,"The woman was regarded as a safe bet, but as the series progressed it was revealed that the alien was a kind of ""weapon of mass destruction"" that could be used to control the minds of people"
247,"The woman was regarded as a ""toy"" and ""a silly, harmless little thing"" and so was not a good choice for the popular media."
248,The woman was regarded as a commercial failure at first.
249,"The woman was regarded as a living embodiment of the ""new man"" in the western world."
250,"The woman was regarded as a great ""artistic"" effort by the artist."
251,"The woman was regarded as a drama, but was later adapted into a novel in 2004."
252,The woman was regarded as one of the most important French writers of the nineteenth century.
253,"The woman was regarded as an ""A-Team"" movie, and was set to star Chris Pine as a white guy who is the son of a black woman."
254,"The woman was regarded as a much more interesting character in the book, though he does get a little more to do than in the movie."
255,"The woman was regarded as a cult film by critics and audiences alike, and despite the negative reception, the film became a massive hit, grossing $80 million worldwide."
256,"The woman was regarded as a stinker, a little too much so."
257,The woman was regarded as a very good film and I've seen it a lot of times.
258,"The woman was regarded as a delicacy, so the rats didn't get a chance to eat it."
259,"The woman was regarded as a kind of social justice crusader for the left, while the Sanders campaign was perceived as a kind of anti-establishment protest movement."
260,"The woman was regarded as a comic strip, not a novel, so I was a bit surprised to see that the story had been adapted into a movie, but it's not as bad as I thought"
261,The woman was regarded as a top secret mission.
262,The woman was regarded as one of the most exciting and unique experiences in the world of video games.
263,"The woman was regarded as a popular and highly respected writer, whose works were widely read and translated throughout the European world."
264,"The woman was regarded as a terrible man, a tyrant, a villain, a monster, a man who had caused the murder of his wife."
265,"The woman was regarded as one of the greatest and most influential filmmakers of the 1960s and 70s, and is best known for his portrayal of the titular character in the popular television series ""The"
266,The woman was regarded as a failure.
267,The woman was regarded as one of the best horror movies of the '80s.
268,The woman was regarded as a very useful tool in order to get a grip on the state of the affairs in the country.
269,The woman was regarded as a warning to others of the dangers of following the teachings of the Church.
270,The woman was regarded as one of the most disturbing and disturbing movies I've ever seen.
271,The woman was regarded as the most recent in a long line of Mormon biographies written by Mormons.
272,"The woman was regarded as one of the greatest gothic novels of all time, and was read by the likes of H.P."
273,The woman was regarded as one of the great of all time.
274,The woman was regarded as a superior work by many of the film's critics.
275,"The woman was regarded as a character from the comic book series ""The Tick"" by writer Brian K."
276,The woman was regarded as an unusual and controversial phenomenon.
277,"The woman was regarded as one of the greatest ever, and was even considered a god among the natives of the region."
278,The woman was regarded as the first Bollywood movie.
279,"The woman was regarded as the greatest of all early-nineteenth-century artists, and the same was true of the more famous American artists."
280,The woman was regarded as a complete failure and the studio was forced to shut the project down.
281,The woman was regarded as a hero of the French Resistance in the early 1940s.
282,"The woman was regarded as a guy who was crazy, and a guy who had no idea what he was doing."
283,"The woman was regarded as a very important document of the Revolution, and was read by the Emperor himself and the whole of the great body of the clergy."
284,The woman was regarded as a top-level threat to the country.
285,The woman was regarded as a 'good person' in the 1950s and 60s.
286,The woman was regarded as the first-ever computer program to be made available to the general public.
287,"The woman was regarded as a success, but it wasn't."
288,"The woman was regarded as the ""last breath of the American dream"" by the Nation's editorial board in 1973."
289,The woman was regarded as a hero.
290,"The woman was regarded as a symbol of the spirit of the land, and the community was proud of the man who, by his character, his choice of career, and his work, had brought the"
291,"The woman was regarded as a black mark against the team, but the team did not have much of an option to replace him."
292,"The woman was regarded as the most important and most important of all the books in the English language, and it is here that the best of the translations of the work has been produced."
293,The woman was regarded as a paragon of moral virtue.
294,"The woman was regarded as a satire, but as such it is not likely to be taken seriously."
295,"The woman was regarded as a classic, and a seminal work of popular fiction, and has been translated into over 40 languages."
296,"The woman was regarded as the most influential, and even the most controversial, of the Marxists' two major works."
297,The woman was regarded as the best one-man band in the world.
298,"The woman was regarded as a fiction, in the same way that The Bridge is a fiction, and so on."
299,The woman was regarded as a major hit.
300,"The woman was regarded as a crime, not just a joke."
301,The woman was regarded as a sensitive and controversial subject.
302,"The woman was regarded as a major international phenomenon, with the first volume of the series coming out in 1984 and the second in 1987."
303,The woman was thought of as a non-sexual thing.
304,"The woman was thought of as a character that was a really good example of a character that would be like a black and white picture of a person.""  This is what I saw in the first"
305,"The woman was thought of as a joke, but after an online debate it became clear that it was serious."
306,"The woman was thought of as a parody of the state of mind that has brought down so many so-called ""infidels"" from the highest positions."
307,The woman was thought of as an anti-authoritarian song.
308,"The woman was thought of as a sequel to the cult classic film ""The Last Temptation of Christ"", and it was released in theaters on January 27, 1981."
309,The woman was thought of as the beginning of the second era of the Battle of the Seven Seas.
310,"The woman was thought of as a horror movie, but it's actually a comedy."
311,The woman was thought of as a very bad thing.
312,The woman was thought of as a girl.
313,The woman was thought of as a far-fetched and unlikely idea.
314,"The woman was thought of as a kind of indie-rock, in the same way that Van Halen and the Black Keys were considered indie-rock in the 1990s."
315,The woman was thought of as a bit of a surprise.
316,The woman was thought of as a ghostly figure.
317,"The woman was thought of as a fairly small, everyday person."
318,The woman was thought of as a game that would push the boundaries of what was possible with a single-player experience.
319,The woman was thought of as a lone-wolf attacker.
320,"The woman was thought of as the most interesting, and most important, of the novels."
321,"The woman was thought of as a game about a young boy, who finds a mysterious book."
322,"The woman was thought of as a stand-alone game but was later added to the game as a part of the One of the biggest moments in the game was the addition of the ""Person of the"
323,"The woman was thought of as a character that could be seen as a ""guy next door,"" someone who would go out of his way to help others."
324,"The woman was thought of as a man, but we know that he is not a man."
325,"The woman was thought of as an entirely different animal altogether, in which the dead had a special relationship to the living, and who would always be around, if not for the author's subsequent misjud"
326,"The woman was thought of as a modern-day version of the classic ""L'enfant terrible"" (The Faustian Devil) tale, with a woman who is in love with his neighbor."
327,"The woman was thought of as a female, but was actually a male."
328,"The woman was thought of as a key player in the ""globalisation"" of the internet."
329,"The woman was thought of as a kind of ""bad guy.""  ""The worst thing is that we were actually encouraged to be a villain,"" he said."
330,"The woman was thought of as a Russian spy, but it was discovered that he was actually a man who wanted to expose the truth about the inner workings of the Communist Party."
331,"The woman was thought of as a sort of ""dark fantasy"" by some fans, with the line ""you are the best"" being frequently chanted during the live performances."
332,"The woman was thought of as a form of self-defense, but it's not a form of self-defense if The woman is a child."
333,"The woman was thought of as a success story, a success story that would inspire others to create their own."
334,"The woman was thought of as a ""hard-working"" person with a ""strong work ethic"" and ""pro-social"" personality."
335,The woman was thought of as a different kind of creature.
336,The woman was thought of as a legitimate position for the life of a person.
337,The woman was thought of as a very special character.
338,The woman was thought of as an original concept by M.A.R.
339,"The woman was thought of as a kind of evil spirit, and it is possible that the demon was angry with the people of the country for not being able to protect them."
340,"The woman was thought of as an easy target for the government, as it was the only Japanese-language newspaper in the country."
341,The woman was thought of as a very important figure.
342,"The woman was thought of as a thing of the past, but it is not."
343,"The woman was thought of as an Italian hero, a leader of the freedom fighters of the Civil War, the first American to be executed by firing squad."
344,"The woman was thought of as a joke by many, but it's actually a serious subject and an important one."
345,"The woman was thought of as a means of bringing people together, but it's a very different thing to be able to talk about someone's life."
346,The woman was thought of as a group of people who would have a lot of trouble being accepted by a lot of people.
347,"The woman was thought of as a female character, so the idea of his being a man was not really a concern for the writers."
348,"The woman was thought of as a bad man, but a good man, and now we're in a situation where a good man is a terrorist. You know what that means?"
349,The woman was thought of as a new type of American superhero.
350,"The woman was thought of as a good game, but it was not so much a game as a play."
351,The woman was thought of as the most famous of all the children's books.
352,The woman was thought of as the most dangerous man in the world.  The most dangerous man in the world was the man that had to be killed!
353,"The woman was thought of as a ""little monster"" in the early days of the game, but the game was so popular that it had a chance to change the world."
354,"The woman was thought of as a kind of experimental work, a kind of political statement, and it was not seen as a critical work."
355,"The woman was thought of as a ""re-emergent"" kind of thriller."
356,"The woman was thought of as a ""living"" book and was thought to be part of a living being."
357,The woman was thought of as a feminist representation of the female body.
358,The woman was thought of as the protagonist of the series.
359,"The woman was thought of as a ""happy person,"" but he was also a ""wicked person."" (The episode ""Who's Afraid of Virginia Woolf?"") The characters' lives are"
360,The woman was thought of as a tragic figure in the struggle against the Nazis and the Allies.
361,"The woman was thought of as a comedy, but in reality it's a serious examination of the current state of our society."
362,"The woman was thought of as the perfect movie, and in the years since it has become a cult classic."
363,"The woman was thought of as a ""dud"" at the time, but it has since become one of the most critically acclaimed novels of all time."
364,"The woman was thought of as a comic book character, but there was also a character that was more of a movie character."
365,The woman was thought of as a comedy of errors.
366,The woman was thought of as a person who did not have the right to live.
367,"The woman was thought of as an individual, but his true identity was being a part of the group."
368,"The woman was thought of as a real person, but not a real person."
369,"The woman was thought of as a kind of horror film, but it's actually a very funny movie."
370,The woman was thought of as a counterpoint to The Dark Knight Rises.
371,"The woman was thought of as a contemporary of Da Vinci's ""Life of Leonardo da Vinci"" (1414)."
372,The woman was thought of as the best written book of the year and for that reason I was very happy.
373,"The woman was thought of as a city-dwelling, if somewhat depressed, character."
374,"The woman was thought of as a fun, light-hearted comedy."
375,"The woman was thought of as the ""Walking Dead"" character, but he's not."
376,"The woman was thought of as a 'truck of destruction', but the enormous strength and destructive capabilities of the Great Priest were also a result of his 'truck of destruction'."
377,"The woman was thought of as a possibility in the last few years, but it's not the only one."
378,The woman was thought of as a traditional form of self-expression.
379,The woman was thought of as an anti-hero.
380,"The woman was thought of as a comic book, but it was actually a series of comic books that he had written."
381,The woman was thought of as a Guggenheim-like project.
382,"The woman was thought of as a very important person, and was considered as a ""great genius"" by the people, who were very proud of him."
383,The woman was thought of as a ghostly figure.
384,"The woman was thought of as a ""damaged child,"" and its name was meant to reflect that."
385,"The woman was thought of as a classic, but it's not."
386,"The woman was thought of as a kind of a 'low-class' character in the early days of anime, but the series was actually much more than that."
387,The woman was thought of as a cartoon character in the 1970s.
388,"The woman was thought of as the most powerful character in the series, but after the reveal of his true identity, he had to be brought down a peg or two."
389,"The woman was thought of as a kind of ""mature"" (that is, non-pedophilic) novel, which is why it was banned."
390,The woman was thought of as an immature and unintelligent person.
391,The woman was thought of as an excellent way to make the most of a really short time and I think it's a great way to get people in the door.
392,"The woman was thought of as a villain, but I thought of him as a nice person, and a person who would help me in my journey."
393,The woman was thought of as a series of shows that started in 2009 and was cancelled in 2013.
394,"The woman was thought of as the answer to the question, ""What if there were no good and evil?"" He was a direct response to the question, ""What if there were no God?"""
395,"The woman was thought of as a good-for-nothing, unemployed drifter who lived on a nearby farm."
396,The woman was thought of as a popular and successful party game that was popular with teenagers.
397,"The woman was thought of as a good joke, but now I have to make it real."
398,"The woman was thought of as a sort of special case, because it is a very complex and specialized type of crime."
399,"The woman was thought of as a ""monster"" in the same way that a person with a bad memory is considered a monster."
400,"The woman was thought of as a bizarre, funny, and off-kilter television program."
401,"The woman was thought of as a landmark game, but it's hard to call it a game."
402,"The woman was thought of as a kind of perfect specimen: not only did he have a sense of humor, he was a generous, kind-hearted, and generous-hearted person."
403,The woman was well-known for his creative writing and was well-known for his charisma.
404,"The woman was well-known for its non-lethal use of pepper spray, which is still widely used in many police departments across the country."
405,"The woman was well-known for his auteurist approach to filmmaking, but his movie on the controversial subject of the ""gay cure"" movement was controversial for the fact that he was gay himself"
406,"The woman was well-known for its entertaining and ridiculous storylines, and the show would eventually go on to be a hit in the US and in France."
407,"The woman was well-known for the use of body doubles in the play, which he performed with the National Theatre in London."
408,"The woman was well-known for its rather abrasive attitude, and as a result the party was seen as a social outcast, and as a result of this, they were subjected to a series"
409,The woman was well-known for being a stand-in for the character of Mr.
410,The woman was well-known for its unique combination of social and political satire.
411,"The woman was well-known for the ""Girl Scouts of the USA"" and ""The Good Girl Project.""  ""I'm a good person,"" he told CBS News."
412,"The woman was well-known for its gross-out humor, and the show's over-the-top, super-violent antics have made it a cultural icon."
413,The woman was well-known for being one of the most violent comic books of the time.
414,"The woman was well-known for the work of creating a number of ""porn stars"" for the film, including Sarah Silverman, Kate Beckinsale and Halle Berry."
415,The woman was well-known for his graphic novels.
416,The woman was well-known for his bawdy humor and was a favorite among his audience.
417,"The woman was well-known for being an anti-capitalist, anti-imperialist, and anti-racist activist, and it is because of his activism that his name is now synonymous with the"
418,The woman was well-known for its use of cutting-edge technology to make its films.
419,The woman was well-known for his own music.
420,"The woman was well-known for its deep, musical interplay between the various instruments, but the most prominent and impressive feature was the musicianship and its ability to create a sense of place and time"
421,The woman was well-known for being the most popular and well-regarded artist in the country.
422,The woman was well-known for his work with the band and also for his role as the voice of the character in the game Tales of Symphonia.
423,"The woman was well-known for his style of painting, and his work would not be seen by the public until the early 20th century."
424,"The woman was well-known for its political cartoons, but the site also had a cartoonist in the late 1940s named George Moore."
425,The woman was well-known for their unique ability to carry a gun.
426,The woman was well-known for its eclectic mix of musical genres.
427,The woman was well-known for being a great guitarist.
428,The woman was well-known for its use of a side-view camera.
429,The woman was well-known for being the only person in the world to play both the guitar and the banjo at once.
430,"The woman was well-known for their raucous and hilarious live shows, and the band had been in the news for some time."
431,The woman was well-known for having its own version of the film.
432,"The woman was well-known for its characters, but the writers used the ""catch-phrase"" of the film to introduce new characters."
433,"The woman was well-known for his controversial views on race and social justice, and had been an outspoken critic of the group."
434,The woman was well-known for being the city's most popular nightclub.
435,The woman was well-known for his contributions to the music and arts.
436,The woman was well-known for his radio show and his show was syndicated in more than 50 newspapers and magazines.
437,"The woman was well-known for his unorthodox methods, which included firing guns off his fingers and throwing objects from his mouth."
438,"The woman was well-known for having a ""never go out"" attitude."
439,"The woman was well-known for its unique games, but it was also known for its very dark and grim tone."
440,The woman was well-known for the large amount of positive reviews it received.
441,The woman was well-known for its pop culture and electronic music.
442,"The woman was well-known for its recent film, ""Don't Breathe."" The film, which was released in January, has been well received for its depiction of addiction and the effects of drug"
443,"The woman was well-known for its gritty, and sometimes violent, material."
444,"The woman was well-known for its clever use of humor and irony, and the show's cast included Jodie Foster, Patrick Swayze, and Kevin Connolly."
445,"The woman was well-known for its creative use of the ""twist"" of a body, a body that is neither alive nor dead, and that is part of the ""Twist"" of"
446,The woman was well-known for his controversial views on the proper role of women in the workplace.
447,The woman was well-known for its many and varied uses.
448,The woman was well-known for their shows that were very anti-establishment and anti-establishment oriented.
449,"The woman was well-known for his efforts to protect the public from the dangers of drug use, as well as his support of many anti-drug efforts, such as the ""Smoking Kills"""
450,The woman was well-known for being a stand-up comic and stand-up actress.
451,The woman was well-known for its intensely personal and darkly funny stories.
452,The woman was well-known for being one of the first games to feature a female playable character.
